{
  "$schema": "http://json-schema.org/draft-07/schema#",
  "title": "head_to_head",
  "type": "array",
  "items": {
    "type": "object",
    "required": [
      "player_a",
      "player_b",
      "a_wins",
      "b_wins"
    ],
    "properties": {
      "player_a": {
        "type": "string"
      },
      "player_b": {
        "type": "string"
      },
      "a_wins": {
        "type": "number"
      },
      "b_wins": {
        "type": "number"
      }
    }
  }
}
